{
    "id": "cleverpet.11",
    "provenance": "cleverpet",
    "start": "2021-09-10T09:54:04.288000",
    "end": "2021-09-10T09:55:04.338000",
    "agents": [
        {
            "id": "cleverpet.dog.0",
            "species": "canis familiaris"
        },
        {
            "id": "cleverpet.human.0",
            "species": "homo sapiens"
        }
    ],
    "events": [
        {
            "id": "cleverpet.0.0",
            "type": "button_press",
            "agent": "cleverpet.human.0",
            "start": "2021-09-10T09:54:06.854667",
            "end": "2021-09-10T09:54:07.354667",
            "content": "Otter"
        },
        {
            "id": "cleverpet.0.1",
            "type": "button_press",
            "agent": "cleverpet.human.0",
            "start": "2021-09-10T09:54:07.254667",
            "end": "2021-09-10T09:54:07.754667",
            "content": "come"
        },
        {
            "id": "cleverpet.0.2",
            "type": "button_press",
            "agent": "cleverpet.human.0",
            "start": "2021-09-10T09:54:20.321333",
            "end": "2021-09-10T09:54:20.821333",
            "content": "null"
        },
        {
            "id": "cleverpet.0.3",
            "type": "button_press",
            "agent": "cleverpet.human.0",
            "start": "2021-09-10T09:54:26.788000",
            "end": "2021-09-10T09:54:27.288000",
            "content": "null"
        },
        {
            "id": "cleverpet.0.4",
            "type": "button_press",
            "agent": "cleverpet.human.0",
            "start": "2021-09-10T09:54:27.188000",
            "end": "2021-09-10T09:54:27.688000",
            "content": "null"
        },
        {
            "id": "cleverpet.0.5",
            "type": "button_press",
            "agent": "cleverpet.human.0",
            "start": "2021-09-10T09:54:27.854667",
            "end": "2021-09-10T09:54:28.354667",
            "content": "null"
        },
        {
            "id": "cleverpet.0.6",
            "type": "button_press",
            "agent": "cleverpet.human.0",
            "start": "2021-09-10T09:54:34.854667",
            "end": "2021-09-10T09:54:35.354667",
            "content": "null"
        },
        {
            "id": "cleverpet.0.7",
            "type": "button_press",
            "agent": "cleverpet.human.0",
            "start": "2021-09-10T09:54:35.221333",
            "end": "2021-09-10T09:54:35.721333",
            "content": "null"
        }
    ]
}